{
  "id": "pattern.spacetimedb-reducer-domain-adapter",
  "type": "pattern",
  "name": "SpacetimeDB Reducer Domain Adapter",
  "slug": "pattern.spacetimedb-reducer-domain-adapter",
  "status": "stable",
  "summary": "Keep reducers as transactional adapters that authorize, load, call explicit domain logic, persist, and emit platform records.",
  "tags": [
    { "tagId": "tag.language", "value": "rust" },
    { "tagId": "tag.framework", "value": "spacetimedb" },
    { "tagId": "tag.layer", "value": "platform" },
    { "tagId": "tag.topic", "value": "reducer" },
    { "tagId": "tag.quality", "value": "boundaries" }
  ],
  "dependencies": [],
  "supports": ["principle.explicit-boundaries"],
  "implements": ["architecture.spacetimedb-domain-module"],
  "body": {
    "sections": [
      {
        "id": "shape",
        "type": "solution",
        "title": "Reducer Shape",
        "blocks": [
          {
            "type": "list",
            "ordered": true,
            "items": [
              "Resolve caller identity or subject and run explicit authz guards.",
              "Load rows and aggregates through repository functions using indexed accessors.",
              "Call the aggregate, domain service, or domain policy function that owns the rule.",
              "Save through repository functions so table identity, mappers, and child reconciliation stay centralized.",
              "Record action logs, events, exports, or other platform side effects inside the same transaction when they are table writes."
            ]
          }
        ]
      },
      {
        "id": "rules",
        "type": "rules",
        "title": "Rules",
        "blocks": [
          {
            "type": "checklist",
            "items": [
              { "text": "Reducer signatures use client-facing identifiers, not surrogate row ids unless row ids are the public contract.", "required": true },
              { "text": "Domain decisions are not implemented as ad hoc reducer conditionals.", "required": true },
              { "text": "External I/O is not performed in reducers.", "required": true }
            ]
          }
        ]
      }
    ]
  }
}
