{
  "id": "recipe.rust-axum-thin-handler",
  "type": "recipe",
  "name": "Rust Axum Thin Handler",
  "slug": "recipe.rust-axum-thin-handler",
  "status": "stable",
  "summary": "Keep Axum handlers thin by limiting them to extraction, use-case invocation, and response mapping.",
  "tags": [
    { "tagId": "tag.language", "value": "rust" },
    { "tagId": "tag.framework", "value": "axum" },
    { "tagId": "tag.layer", "value": "http" },
    { "tagId": "tag.quality", "value": "simplicity" }
  ],
  "dependencies": [
    { "type": "cargo", "name": "axum" },
    { "type": "cargo", "name": "serde" }
  ],
  "implements": ["pattern.http-use-case-adapter", "stack.rust-axum"],
  "agent": {
    "rules": [
      "The handler should delegate behavior to an existing use case instead of implementing application decisions inline.",
      "Request and response DTOs belong at the HTTP boundary.",
      "If the application/use-case boundary does not already exist, do not create business behavior as part of the Axum adapter task; report the missing prerequisite."
    ],
    "checks": [
      "Handler code is mostly extraction, input construction, await, and response mapping.",
      "The use-case function or trait does not depend on axum types."
    ],
    "promptFragments": [
      "When adding an Axum endpoint, first identify the existing use-case entry point and its input/output types, then adapt the HTTP request into that contract."
    ]
  },
  "body": {
    "sections": [
      {
        "id": "implementation",
        "type": "guidance",
        "title": "Implementation Steps",
        "blocks": [
          {
            "type": "list",
            "ordered": true,
            "items": [
              "Find the existing use-case entry point and required dependencies.",
              "Stop and report the missing prerequisite if no existing application/use-case boundary owns the behavior.",
              "Add or reuse an application state accessor for those dependencies.",
              "Define HTTP request and response DTOs in the transport layer.",
              "Map request DTOs and route/path/query values into the use-case input.",
              "Await the use case and map the result into a response DTO.",
              "Register the route near related Axum route definitions."
            ]
          }
        ]
      },
      {
        "id": "example",
        "type": "examples",
        "title": "Generic Handler Shape",
        "blocks": [
          {
            "type": "code",
            "language": "rust",
            "code": "use axum::{\n    extract::State,\n    http::StatusCode,\n    response::{IntoResponse, Response},\n    routing::post,\n    Json, Router,\n};\nuse serde::{Deserialize, Serialize};\n\nfn routes(state: AppState) -> Router {\n    Router::new()\n        .route(\"/resources\", post(endpoint_handler))\n        .with_state(state)\n}\n\n#[derive(Debug, Deserialize)]\nstruct EndpointRequest {\n    value: String,\n}\n\n#[derive(Debug, Serialize)]\nstruct EndpointResponse {\n    id: String,\n}\n\nasync fn endpoint_handler(\n    State(state): State<AppState>,\n    Json(request): Json<EndpointRequest>,\n) -> Result<impl IntoResponse, ApiError> {\n    let input = UseCaseInput::from(request);\n    let output = state.use_cases.target_use_case.execute(input).await?;\n\n    Ok((StatusCode::CREATED, Json(EndpointResponse::from(output))))\n}\n\nstruct ApiError(AppError);\n\nimpl From<AppError> for ApiError {\n    fn from(error: AppError) -> Self {\n        Self(error)\n    }\n}\n\nimpl IntoResponse for ApiError {\n    fn into_response(self) -> Response {\n        let (status, code) = match self.0 {\n            AppError::InvalidInput => (StatusCode::BAD_REQUEST, \"invalid_input\"),\n            AppError::NotFound => (StatusCode::NOT_FOUND, \"not_found\"),\n            AppError::Conflict => (StatusCode::CONFLICT, \"conflict\"),\n        };\n\n        (status, Json(ErrorResponse { code })).into_response()\n    }\n}\n\n#[derive(Debug, Serialize)]\nstruct ErrorResponse {\n    code: &'static str,\n}"
          }
        ]
      },
      {
        "id": "references",
        "type": "references",
        "title": "References",
        "blocks": [
          {
            "type": "ppp-ref",
            "slug": "pattern.http-use-case-adapter",
            "required": true,
            "reason": "Thin handlers are the Axum implementation of the adapter pattern."
          }
        ]
      }
    ]
  }
}
