{
  "id": "pattern.spacetimedb-repository-mapper-boundary",
  "type": "pattern",
  "name": "SpacetimeDB Repository Mapper Boundary",
  "slug": "pattern.spacetimedb-repository-mapper-boundary",
  "status": "stable",
  "summary": "Centralize SpacetimeDB table access in repositories and row/domain shape conversion in mappers.",
  "tags": [
    { "tagId": "tag.language", "value": "rust" },
    { "tagId": "tag.framework", "value": "spacetimedb" },
    { "tagId": "tag.layer", "value": "platform" },
    { "tagId": "tag.topic", "value": "table" },
    { "tagId": "tag.quality", "value": "boundaries" }
  ],
  "dependencies": [],
  "supports": ["principle.explicit-boundaries"],
  "implements": ["architecture.spacetimedb-domain-module"],
  "body": {
    "sections": [
      {
        "id": "responsibilities",
        "type": "guidance",
        "title": "Responsibilities",
        "blocks": [
          {
            "type": "list",
            "items": [
              "Rows are dumb SpacetimeDB storage records with table attributes, indexes, and public fields.",
              "Mappers are the only code that knows both row shapes and domain aggregate shapes.",
              "Repositories are the only code that knows table accessors, surrogate row ids, scoped uniqueness guards, and save/delete ordering.",
              "Reducers and views call repository functions instead of scattering `ctx.db` access for aggregate state."
            ]
          }
        ]
      }
    ]
  }
}
