{
  "id": "recipe.spacetimedb-multi-table-aggregate-reconciliation",
  "type": "recipe",
  "name": "SpacetimeDB Multi-Table Aggregate Reconciliation",
  "slug": "recipe.spacetimedb-multi-table-aggregate-reconciliation",
  "status": "stable",
  "summary": "Persist aggregate child collections as separate tables using pure natural-key diff plans executed by repositories.",
  "tags": [
    { "tagId": "tag.language", "value": "rust" },
    { "tagId": "tag.framework", "value": "spacetimedb" },
    { "tagId": "tag.topic", "value": "reconciliation" },
    { "tagId": "tag.quality", "value": "testability" }
  ],
  "dependencies": [],
  "implements": ["pattern.spacetimedb-repository-mapper-boundary"],
  "body": {
    "sections": [
      {
        "id": "steps",
        "type": "solution",
        "title": "Steps",
        "blocks": [
          {
            "type": "list",
            "ordered": true,
            "items": [
              "Load current child rows with a scoped index such as `(workspace_id, aggregate_id)`.",
              "Build desired child rows from the domain aggregate with surrogate primary keys set to zero.",
              "Diff current and desired rows by natural key, not by auto-increment row id.",
              "For matched rows, graft the stored row id onto the desired row before update and skip unchanged rows.",
              "Return an insert/update/delete plan from pure code and let the repository execute it."
            ]
          }
        ]
      },
      {
        "id": "checks",
        "type": "checks",
        "title": "Checks",
        "blocks": [
          {
            "type": "checklist",
            "items": [
              { "text": "Reconciliation tests prove updates preserve stored row ids.", "required": true },
              { "text": "Unchanged children are not written back unnecessarily.", "required": true },
              { "text": "Insert/delete behavior is tested for removed and newly added child natural keys.", "required": true }
            ]
          }
        ]
      }
    ]
  }
}
