{
  "id": "stack.rust-spacetimedb",
  "type": "stack",
  "name": "Rust SpacetimeDB",
  "slug": "stack.rust-spacetimedb",
  "status": "stable",
  "summary": "Rust SpacetimeDB module stack using tables, reducers, views, and generated client-facing bindings.",
  "tags": [
    { "tagId": "tag.language", "value": "rust" },
    { "tagId": "tag.framework", "value": "spacetimedb" },
    { "tagId": "tag.stack", "value": "rust-spacetimedb" },
    { "tagId": "tag.topic", "value": "spacetimedb" }
  ],
  "dependencies": [
    { "type": "cargo", "name": "spacetimedb", "version": "2" },
    { "type": "cargo", "name": "serde" },
    { "type": "cargo", "name": "serde_json" },
    { "type": "cargo", "name": "log" }
  ],
  "implements": ["architecture.spacetimedb-domain-module"],
  "body": {
    "sections": [
      {
        "id": "conventions",
        "type": "guidance",
        "title": "Module Conventions",
        "blocks": [
          {
            "type": "list",
            "items": [
              "Define persisted and synced state as SpacetimeDB tables in module code.",
              "Expose mutations as reducers; treat each reducer as a transactional boundary.",
              "Keep pure domain modules free of `spacetimedb` imports when the slice has domain rules.",
              "Expose caller-scoped read surfaces with views or filtered subscriptions rather than client-side authorization assumptions."
            ]
          }
        ]
      }
    ]
  }
}
