{
  "id": "antipattern.sql-in-http-handler",
  "type": "antipattern",
  "name": "SQL In HTTP Handler",
  "slug": "antipattern.sql-in-http-handler",
  "status": "stable",
  "summary": "Avoid placing direct SQL or persistence-specific query logic inside HTTP handlers.",
  "tags": [
    { "tagId": "tag.layer", "value": "http" },
    { "tagId": "tag.topic", "value": "sql-boundary" },
    { "tagId": "tag.quality", "value": "boundaries" }
  ],
  "dependencies": [],
  "supports": ["principle.explicit-boundaries"],
  "related": ["pattern.http-use-case-adapter", "recipe.rust-axum-thin-handler"],
  "agent": {
    "antiPatterns": [
      "Do not open database transactions or execute SQL directly from an Axum handler when an application use case should own the operation.",
      "Do not let HTTP route shape dictate persistence model shape."
    ],
    "checks": [
      "Persistence code is behind an application or infrastructure boundary, not inline in the handler."
    ]
  },
  "body": {
    "sections": [
      {
        "id": "problem",
        "type": "problem",
        "title": "Problem",
        "blocks": [
          {
            "type": "markdown",
            "markdown": "Direct persistence work in an HTTP handler couples protocol, transaction, query, and behavior decisions. That makes reuse and focused tests harder."
          }
        ]
      },
      {
        "id": "avoidance",
        "type": "guidance",
        "title": "Avoidance",
        "blocks": [
          {
            "type": "ppp-ref",
            "slug": "recipe.rust-axum-thin-handler",
            "required": true,
            "reason": "Thin handler guidance avoids persistence leakage."
          }
        ]
      }
    ]
  }
}
