{
  "id": "validation.rust-api-endpoint-checks",
  "type": "validation",
  "name": "Rust API Endpoint Checks",
  "slug": "validation.rust-api-endpoint-checks",
  "status": "stable",
  "summary": "Review and test checks for exposing a use case through a Rust Axum HTTP endpoint.",
  "tags": [
    { "tagId": "tag.language", "value": "rust" },
    { "tagId": "tag.framework", "value": "axum" },
    { "tagId": "tag.topic", "value": "api-endpoint" },
    { "tagId": "tag.quality", "value": "testability" }
  ],
  "dependencies": [],
  "supports": ["principle.explicit-boundaries"],
  "implements": ["pattern.http-use-case-adapter"],
  "agent": {
    "checks": [
      "When a Cargo workspace or package is present, run cargo check, cargo fmt --check, and cargo test; report why for any check that is not feasible.",
      "Confirm the handler delegates to an existing application/use-case boundary before implementing; if not, report the missing prerequisite instead of creating business behavior.",
      "Review that the handler does not contain persistence queries or domain decisions.",
      "Verify expected success and error responses are covered by tests or explicit review."
    ]
  },
  "body": {
    "sections": [
      {
        "id": "checks",
        "type": "checks",
        "title": "Endpoint Checks",
        "blocks": [
          {
            "type": "checklist",
            "items": [
              { "text": "Route is registered and uses the intended HTTP method and path.", "required": true },
              { "text": "An existing application/use-case boundary owns the behavior before the Axum adapter is added; if absent, the missing prerequisite is reported and no business behavior is created.", "required": true },
              { "text": "Handler delegates to the existing use-case boundary.", "required": true },
              { "text": "Request DTO validation or parsing failures return intentional client errors.", "required": true },
              { "text": "Application errors are mapped to stable HTTP responses.", "required": true },
              { "text": "cargo check, cargo fmt --check, and cargo test were run when a Cargo workspace or package is present, or the reason each infeasible command could not run is recorded.", "required": true }
            ]
          }
        ]
      }
    ]
  }
}
